[
    {
        "name": "Cultured",
        "friendBonusUniques": [
            "[+3 Culture] <before the [Medieval era]>",
            "[+6 Culture] <starting from the [Medieval era]> <before the [Industrial era]>",
            "[+13 Culture] <starting from the [Industrial era]>"
        ],
        "allyBonusUniques": [
            "[+6 Culture] <before the [Medieval era]>",
            "[+12 Culture] <starting from the [Medieval era]> <before the [Industrial era]>",
            "[+26 Culture] <starting from the [Industrial era]>"
        ],
        "color": [139, 96, 255]
    },
    {
        "name": "Maritime",
        "friendBonusUniques": ["[+2 Food] [in capital]"],
        "allyBonusUniques": ["[+2 Food] [in capital]", "[+1 Food] [in all cities]"],
        "uniques": ["Start bias [Coast]"],
        "color": [56, 255, 112]
    },
    {
        "name": "Mercantile",
        "friendBonusUniques": [
            "[+2 Happiness] <before the [Medieval era]>",
            "[+3 Happiness] <starting from the [Medieval era]>"
        ],
        "allyBonusUniques": [
            "[+2 Happiness] <before the [Medieval era]>",
            "[+3 Happiness] <starting from the [Medieval era]>",
            "Provides a unique luxury"
        ],
        "color": [255, 216, 0]
    },
    {
        "name": "Militaristic",
        "friendBonusUniques": ["Provides military units every ≈[20] turns"],
        "allyBonusUniques": ["Provides military units every ≈[17] turns"],
        "color": [255, 0, 0]
    },
    {
        "name":"Religious",
        "friendBonusUniques":  [
            "[+3 Faith] <before the [Medieval era]>",
            "[+6 Faith] <starting from the [Medieval era]> <before the [Industrial era]>",
            "[+13 Faith] <starting from the [Industrial era]>"
        ],
        "allyBonusUniques":  [
            "[+6 Faith] <before the [Medieval era]>",
            "[+12 Faith] <starting from the [Medieval era]> <before the [Industrial era]>",
            "[+26 Faith] <starting from the [Industrial era]>"
        ],
        "color": [255, 255, 255]
    }
]
